{
  "$schema": "https://json-schema.org/draft/2020-12/schema",
  "$id": "https://love-fortune.invalid/contracts/historical/zodiac-v1/schemas/daily-response.schema.json",
  "title": "LOVE FORTUNE daily-response Zodiac V1",
  "description": "Active V1 SAJU + ZODIAC. Advanced Astrology is not part of this response.",
  "type": "object",
  "properties": {
    "meta": {
      "$ref": "common.schema.json#/$defs/meta"
    },
    "date": {
      "type": "string",
      "format": "date",
      "pattern": "^(19|20)[0-9]{2}-[0-9]{2}-[0-9]{2}$"
    },
    "targetTimezone": {
      "type": "string",
      "minLength": 1,
      "description": "Required semantic IANA tzdb validation; no implicit default."
    },
    "lifetimeScore": {
      "anyOf": [
        {
          "type": "number",
          "minimum": 0,
          "maximum": 100,
          "multipleOf": 0.0001
        },
        {
          "type": "null"
        }
      ]
    },
    "dailyScore": {
      "anyOf": [
        {
          "type": "number",
          "minimum": 0,
          "maximum": 100,
          "multipleOf": 0.0001
        },
        {
          "type": "null"
        }
      ]
    },
    "dailyDelta": {
      "type": "number",
      "minimum": -18,
      "maximum": 18,
      "multipleOf": 0.0001
    },
    "dailyStatus": {
      "enum": [
        "VERY_LOW",
        "LOW",
        "STABLE",
        "GOOD",
        "VERY_GOOD",
        "INSUFFICIENT_PERIOD_DATA",
        "INSUFFICIENT_DATA"
      ]
    },
    "resultConfidence": {
      "type": "number",
      "minimum": 0,
      "maximum": 1
    },
    "coverage": {
      "type": "number",
      "minimum": 0,
      "maximum": 1
    },
    "features": {
      "type": "array",
      "items": {
        "allOf": [
          {
            "$ref": "feature.schema.json"
          },
          {
            "properties": {
              "source": {
                "const": "SAJU"
              }
            }
          }
        ]
      }
    },
    "warnings": {
      "$ref": "common.schema.json#/$defs/warnings"
    },
    "signedInterpretationContext": {
      "type": "string",
      "minLength": 1
    },
    "zodiacContext": {
      "$ref": "zodiac-context.schema.json"
    },
    "categoryScores": {
      "type": "object",
      "properties": {
        "ATTRACTION": {
          "anyOf": [
            {
              "$ref": "common.schema.json#/$defs/score"
            },
            {
              "type": "null"
            }
          ]
        },
        "EMOTION": {
          "anyOf": [
            {
              "$ref": "common.schema.json#/$defs/score"
            },
            {
              "type": "null"
            }
          ]
        },
        "COMMUNICATION": {
          "type": "null"
        },
        "PASSION": {
          "anyOf": [
            {
              "$ref": "common.schema.json#/$defs/score"
            },
            {
              "type": "null"
            }
          ]
        },
        "STABILITY": {
          "anyOf": [
            {
              "$ref": "common.schema.json#/$defs/score"
            },
            {
              "type": "null"
            }
          ]
        },
        "HARMONY": {
          "anyOf": [
            {
              "$ref": "common.schema.json#/$defs/score"
            },
            {
              "type": "null"
            }
          ]
        },
        "SUPPORT": {
          "anyOf": [
            {
              "$ref": "common.schema.json#/$defs/score"
            },
            {
              "type": "null"
            }
          ]
        },
        "LONG_TERM": {
          "anyOf": [
            {
              "$ref": "common.schema.json#/$defs/score"
            },
            {
              "type": "null"
            }
          ]
        }
      },
      "required": [
        "ATTRACTION",
        "EMOTION",
        "COMMUNICATION",
        "PASSION",
        "STABILITY",
        "HARMONY",
        "SUPPORT",
        "LONG_TERM"
      ],
      "additionalProperties": false,
      "description": "Optional final category scores. Internal Saju COMMUNICATION signal never becomes a public numeric score."
    }
  },
  "required": [
    "meta",
    "date",
    "targetTimezone",
    "lifetimeScore",
    "dailyScore",
    "dailyDelta",
    "dailyStatus",
    "resultConfidence",
    "coverage",
    "features",
    "warnings"
  ],
  "additionalProperties": false,
  "allOf": [
    {
      "if": {
        "properties": {
          "dailyStatus": {
            "const": "INSUFFICIENT_PERIOD_DATA"
          }
        }
      },
      "then": {
        "properties": {
          "dailyDelta": {
            "const": 0
          },
          "resultConfidence": {
            "const": 0
          }
        }
      }
    },
    {
      "if": {
        "properties": {
          "lifetimeScore": {
            "type": "null"
          }
        }
      },
      "then": {
        "properties": {
          "dailyScore": {
            "type": "null"
          },
          "dailyStatus": {
            "const": "INSUFFICIENT_DATA"
          },
          "resultConfidence": {
            "const": 0
          }
        }
      }
    },
    {
      "if": {
        "properties": {
          "dailyScore": {
            "type": "null"
          }
        }
      },
      "then": {
        "properties": {
          "dailyStatus": {
            "const": "INSUFFICIENT_DATA"
          },
          "resultConfidence": {
            "const": 0
          }
        }
      },
      "else": {
        "properties": {
          "dailyStatus": {
            "not": {
              "const": "INSUFFICIENT_DATA"
            }
          }
        }
      }
    },
    {
      "if": {
        "properties": {
          "dailyStatus": {
            "const": "VERY_LOW"
          }
        }
      },
      "then": {
        "properties": {
          "dailyDelta": {
            "maximum": -5
          }
        }
      }
    },
    {
      "if": {
        "properties": {
          "dailyStatus": {
            "const": "LOW"
          }
        }
      },
      "then": {
        "properties": {
          "dailyDelta": {
            "exclusiveMinimum": -5,
            "maximum": -2
          }
        }
      }
    },
    {
      "if": {
        "properties": {
          "dailyStatus": {
            "const": "STABLE"
          }
        }
      },
      "then": {
        "properties": {
          "dailyDelta": {
            "exclusiveMinimum": -2,
            "exclusiveMaximum": 2
          }
        }
      }
    },
    {
      "if": {
        "properties": {
          "dailyStatus": {
            "const": "GOOD"
          }
        }
      },
      "then": {
        "properties": {
          "dailyDelta": {
            "minimum": 2,
            "exclusiveMaximum": 5
          }
        }
      }
    },
    {
      "if": {
        "properties": {
          "dailyStatus": {
            "const": "VERY_GOOD"
          }
        }
      },
      "then": {
        "properties": {
          "dailyDelta": {
            "minimum": 5
          }
        }
      }
    }
  ]
}
